217,23,12:54,"I was thinking it was a really good questions and must make more people pay attention to it, and it reminded me of our residential area, there is one car driving crazily now and then, which is absolutely mad and so dangerous for all, especially for little kids",She was feeling happy that she got the point of residential area,0,1,0,0.333,+,+,TRUE,,,,,,,,,,,,,,,,,,,,
218,23,18:06,"I was feeling I didn’t exactly do as I told in the interview, sometimes I just took for granted that that kind of accident will never happen to me, but when expressed vocally, it reminds me how important to all the time follow the traffic rules",She was feeling this information is very important and she was repeating her answer,1,0,0,0.333,0,0,TRUE,,,,,,,,,,,,,,,,,,,,
219,23,21:24,"I was excited about this idea, I first thought it might be some kind of artificial intelligence that could replace human drving","She was thinking she did not have an experience like that, and it is hard for her to imagine the situation, and she hope her answer is still useful",0,1,0,0.333,0,0,TRUE,,,,,,,,,,,,,,,,,,,,
220,23,27:39,"I was forgetting to tell, that i hope this device could be some combination of navigator, dangerous waring, monitoring camera, speed monitor etc. ",She was thinking this is hard to answer and she already provided almost everthing in her mind and thinking how to produce more,0,0,0,0.000,+,0,FALSE,,,,,,,,,,,,,,,,,,,,
221,24,2:13,I was thinking I have a country's driver's license but have no driving experience in the country.,he was thinking the time when he get a country driving license (the calculation stuff),1,1,1,1.000,0,0,TRUE,,,,,,,,,,,,,,,,,,,,
222,24,4:50,"I was thinking in 2018, I drive my car to have parties with my friends around 5 times per week, what crazy. For a party, my friend needs a driver who does not drink alcohol so they can drink as I can drive them home. That is one why I was so busy with parties. I can get my PhD done earlier if I could spend more time working. ",He was feeling it is hard to explain in English and not sure if the interviewer is understanding him or not,0,0,0,0.000,0,-,FALSE,,,,,,,,,,,,,,,,,,,,
223,24,6:15,I was thinking having a car really makes my life easier and more colorful.,"He was thinking about what else he uses the car to do something, and car is much easier than public transportation for him",1,1,0,0.667,+,+,TRUE,,,,,,,,,,,,,,,,,,,,
224,24,12:09,I was thinking many people with an international driver’s license drive in city but don’t know the  traffic rules.,He does not think tram is a problem since he just follows the traffic rule.,0,0,0,0.000,-,0,FALSE,,,,,,,,,,,,,,,,,,,,
225,24,12:28,I was thinking you can stop your car if the driving condition is bad. ,"He was thinking of the situation and recalled his memory that related to this situation, and he may not have many experiences related to this situation",0,0,0,0.000,0,0,TRUE,,,,,,,,,,,,,,,,,,,,
226,24,14:10,"I was thinking driving in bad weather condition is really dangerous. If you have to go, the first thing you need to know is the pedestrains near you.  ",He was not fully understanding this question and want to make sure what is the question,0,0,0,0.000,-,0,FALSE,,,,,,,,,,,,,,,,,,,,
227,24,16:42,"I was thinking for the intersection part, slow down and even stop your car, observe the traffic conditions (cars, signs), make the decision to follow the traffic rules. ",He was thinking tall building blocking his view what he will do and he was aware of people and other road users,1,0,0,0.333,+,0,FALSE,,,,,,,,,,,,,,,,,,,,
228,24,22:42,I was thinking that being prepared for any unexpected is good. ,He was not sure if the device will be helpful in that situation and if he has a need according to that since he has no such experience,0,0,0,0.000,+,0,FALSE,,,,,,,,,,,,,,,,,,,,
229,24,23:57,I was thinking the device is to support drivers. So do not make it too complicated. Avoid asking drivers to set too many parameters. Also do not disturb drivers. So to many fake warnings should be avoided.   ,"He was thinking audio is enough and he has enough experience to handle different driving situation, he could judge by himself",0,1,0,0.333,+,0,FALSE,,,,,,,,,,,,,,,,,,,,
230,24,27:29,I was thinking autonomous vehicle is a big challenge for your device. Is it really a need to have a device to support driver? ,He was thinking inserting a camera in the street may cause some license problems and not realistic.,0,0,0,0.000,0,-,FALSE,,,,,,,,,,,,,,,,,,,,
231,25,4:00,"I was recalling  the time I have to wake up at 5am to send some of my relatives to airports or train stations, it was supper tired!",She was thinking the experience of sending her friends and relatives from the airport when they visit the city,2,1,1,1.333,-,+,FALSE,,,,,,,,,,,,,,,,,,,,
232,25,7:14,"I was thinking if I should use the word ""handsome""? At least my friends told me that I was handsome when I am driving ;)","She was thinking that she  really likes driving and feeling confidence when she drives, and she likes how her friends describe how she drive",1,1,0,0.667,+,+,TRUE,,,,,,,,,,,,,,,,,,,,
233,25,8:20,I was missing the time when I was listening to my favorite song and chating with my best friend on our journey.,She was thinking how to say this in English and feeling it is hard to explain,0,0,0,0.000,+,0,FALSE,,,,,,,,,,,,,,,,,,,,
234,25,8:50,I was thinking traffic jam is coming,She was feeling happy that she finish the task of giving a definition of driving and thinking about driving in an intersection in  city centre,0,0,0,0.000,0,0,TRUE,,,,,,,,,,,,,,,,,,,,
235,25,17:20,I was thinking why I can't see the intersection because of the tall buildings? What do the roads look like? Hard to image…,"she was thinking of the situation when she was driving and thinking of a town, also, a bit happy this is the last scenario",1,0,0,0.333,0,0,TRUE,,,,,,,,,,,,,,,,,,,,
236,25,19:11,I was thinking I have no choice to change my route… ,"She was thinking she has not been in a situation because of tall buildings, but she has experience of  traffic jams for other reasons and she cannot do anything with that",0,0,0,0.000,0,-,FALSE,,,,,,,,,,,,,,,,,,,,
237,25,23:40,I was thinking I want a car with a funny robot to talk with me!,She was thinking she need a really smart device that can take action based on her spoken command and also feel curious of the device.,0,0,0,0.000,+,0,FALSE,,,,,,,,,,,,,,,,,,,,
238,25,28:50,"I was thinking The weather outside is great, I can feel the fresh air after the heavy rain.",She was thinking how to say it in English and finding it hard to find a suitable word,0,0,0,0.000,+,-,FALSE,,,,,,,,,,,,,,,,,,,,
239,25,30:15,I was thinking Siri was not smart at all! It even can't tell a joke to me,"she was thinking yes, could be like a smarter Siri, which is a good example, and something like that can communicate with driver",0,1,2,1.000,0,+,FALSE,,,,,,,,,,,,,,,,,,,,
240,25,34:20,"I was finding the balance between the personal driving experience and AI assistance maybe more important, driving is a event that people can enjoy the feeling than operating a big machine, that's a coolest thing.",she was thinking about how to explain it clearly in English and feeling a bit happy that she finally came up with a word,0,0,0,0.000,+,0,FALSE,,,,,,,,,,,,,,,,,,,,
241,26,3:13,I was thinking that every driver will drive to go shopping or go to work ,"He was thinking he doesn't know how to say it in English and hopefully, he can explain it clearly and feeling a bit nervous",0,0,0,0.000,0,-,FALSE,,,,,,,,,,,,,,,,,,,,
242,26,3:24,I was thinking that driving to travel might be a good purpose,"He was thinking luckily the interviewer provide some options and another more difficult question comes here. For him, there is no favourite purpose, they are the same",1,0,0,0.333,+,0,FALSE,,,,,,,,,,,,,,,,,,,,
243,26,6:25,I was thnking this is a very common thing and does not require additional information ,He was feeling confused about the scenario and wondering what is the interviewer's question,0,0,0,0.000,0,-,FALSE,,,,,,,,,,,,,,,,,,,,
244,26,7:15,"I was thinking that in my experience, I pay attention to whether anyone runs the red light, but I don’t know how to express it in English. ",He was concentrating on the interviewer's explanation and don't know how to put the answer in English,1,1,1,1.000,-,0,FALSE,,,,,,,,,,,,,,,,,,,,
245,26,9:40,I was thinking about what to do if it rains heavily ,He was feeling he doesn't know how to say it in English and in native is much easier,0,0,0,0.000,0,-,FALSE,,,,,,,,,,,,,,,,,,,,
246,26,13:35,I was  confirming that I understand the question correctly,He was feeling very confused about this question and don't understand why this is a problem,2,0,0,0.667,+,-,FALSE,,,,,,,,,,,,,,,,,,,,
247,26,14:46,"I was thinking that I understand this question is to ask me if I will pay attention to the behavior of the car next to me while driving, but I think this example does not seem appropriate ","He was thinking he does not understand this question even if it is in his native, this is not a problem for him at all",0,0,0,0.000,0,-,FALSE,,,,,,,,,,,,,,,,,,,,
248,26,16:35,I was thinking of smart driving or auto-driving,"He was thinking what is a device and want to check in google translation, and glad the interivewer explain it in his native now",0,0,0,0.000,+,-,FALSE,,,,,,,,,,,,,,,,,,,,
249,26,21:11,I was thinking of the state of the art reversing radar,"He was thinking finding a parking spot is so useful for him, this is exactly what he wants",0,0,0,0.000,0,+,FALSE,,,,,,,,,,,,,,,,,,,,
250,26,24:50,I was thinking this product should devote more attention to finding parking position ,He was thinking it is much easier to understand in his native and i can provide more suggestion of the device in my mother tone,0,0,0,0.000,0,+,FALSE,,,,,,,,,,,,,,,,,,,,
251,27,2:16,I was thinking the public transportation is very good in the city,He was thinking the purpose of using a car in the city and he has a family so he is not able to take children by public transportations. This is not convinent for people who has family and the interviewer probably has no children. ,0,0,1,0.333,+,0,FALSE,,,,,,,,,,,,,,,,,,,,
252,27,3:26,"I was thinking the experience of driving in a beautiful nature of the city, and that is my best experience ",He was thinking which one is his favourite driving purpose,1,0,0,0.333,+,0,FALSE,,,,,,,,,,,,,,,,,,,,
253,27,7:28,"I was thinking when you say animals, I was thinking of pets, such as dogs, not moose or other wild animals",He was thinking the situation how people take care of their pets in the street and it is not a problem for driver,1,0,1,0.667,0,0,TRUE,,,,,,,,,,,,,,,,,,,,
254,27,10:36,I was thinking that was a good lesseon but not good experience ,"He was thinking of his experience of driving in the snow, and it was a very dangerous and nervous experience, this may be helpful for the interviewer",1,1,0,0.667,-,-,TRUE,,,,,,,,,,,,,,,,,,,,
255,27,12:12,I was thinking I pay more attention of safe driving in winter time after that experience,He was feeling he does not know how to put this into English and speaking in his native is much easier,0,0,0,0.000,0,+,FALSE,,,,,,,,,,,,,,,,,,,,
256,27,13:54,I was thinking there are not many tall buildings,"He was thinking he does not have so much experience of tall buildings in the city, it is a bit rare",2,1,1,1.333,0,0,TRUE,,,,,,,,,,,,,,,,,,,,
257,27,16:57,"I was thinking I can accept the price of device is below 200€, and 100€ will be a good price for me. If it is a App, 5€ per month is suitable for me, but if it is 3€ per month, I will also purchase for my wife","He was thinking he will not buy a very expensive one and it is hard to say how much if he does not know what the device is, maybe 100€ - 200€ is a reasonable price for him",1,2,0,1.000,0,0,TRUE,,,,,,,,,,,,,,,,,,,,
258,27,21:10,I was thinking it will be great if the device can translate the traffic sign from a language to another,"He was thinking it is not often to see wild animals in the city but it is common in other places, they may need it",0,0,0,0.000,+,+,TRUE,,,,,,,,,,,,,,,,,,,,
259,27,24:15,"I was thinking electrical car is the future, and most of them have AI system. Especially those country's  electrical car companies. Try to work with them to develop your app. ","He was thinking it is hard to explain in English but he tried to explain and hopefully it is clear enough, and if it comes with an App or be a part of an App it will be much better",0,1,0,0.333,+,0,FALSE,,,,,,,,,,,,,,,,,,,,
260,28,4:03,I was thinking why my answers are so funny.,He was thinking how to explain why he feels happy when driving for shopping,0,0,0,0.000,+,+,TRUE,,,,,,,,,,,,,,,,,,,,
261,28,4:39,"I was little drama queen (give me some time, let me think how to explain. Hmmm Yeah, this is absolutely driving experience)","He was feeling confused about the question, and it is hard to say where the happy experience comes from",0,0,0,0.000,0,0,TRUE,,,,,,,,,,,,,,,,,,,,
262,28,5:09,I was shy. Let me think about how to express my thinking in English.,"He was thinking, why adjust the camera and feel a bit shy at that moment",0,1,0,0.333,0,0,TRUE,,,,,,,,,,,,,,,,,,,,
263,28,9:58,I was thinking that my spoken english is really bad. Sad.,He was feeling a bit embrassing of his English and try to understand the question and a bit happy and finally comes up with a word to describe driving. ,1,1,1,1.000,-,+,FALSE,,,,,,,,,,,,,,,,,,,,
264,28,12:22,I was thinking I do not know how to speak. The words hot mouth.,He was thinking of his driving experience in that situation and feeling when to wait for people is a problem for him,0,0,0,0.000,0,-,FALSE,,,,,,,,,,,,,,,,,,,,
265,28,21:20,"I was Sorry, not ""reply with rule"", it should be ""follow the rule""",He was recalling his experience in this situation and many people are doing the same thing,0,0,0,0.000,0,0,TRUE,,,,,,,,,,,,,,,,,,,,
266,28,21:52,"I was thinking  ""Could I trust this device (trustworthy)?""  The ""safe"" is not an accurate word. Sorry about that I do not know how to express myself in English at that moment. Does it provide full (whole/complete) information about the roads? I hope this is not partial information. Only providing partial information is dangerous. It may be better not to provide information at all. And could it give an error message? If I could trust this device, and device could tell me the information. The information I need is ... (Sorry again, I do not know how to express myself at that moment correctly.) Yes, when you tell me that there is a device, my first thought is, ""could I trust the information provided by this device?"" Not what kinds of information I need from this device.","He was thinking what the device is and what does this question mean, he does not understand the purpose of the device",1,1,0,0.667,0,-,FALSE,,,,,,,,,,,,,,,,,,,,
267,28,23:35,"I was thinking that for different kinds of wrong information, I have a different tolerance.",He was thinking how to say it in English and he will not buy the device if the device provide wrong infromation that outlast critical accidents,0,0,0,0.000,0,0,TRUE,,,,,,,,,,,,,,,,,,,,
268,28,25:45,"I was thinking, personally, I have my doubts.",He was thinking how to put it in English and he was thinking he cannot fully trust a device since it sometimes cannot that accurately provide information,1,1,0,0.667,0,0,TRUE,,,,,,,,,,,,,,,,,,,,
269,28,29:19,I was thinking  many people are not rich. I think this a common thing (universal phenomenon). Many people will need this information (free park lots).,He was thinking free is the most important thing and free parking is very attractive,2,0,2,1.333,+,+,TRUE,,,,,,,,,,,,,,,,,,,,
270,29,1:01,I was thinking a little bit long introduction ,She was thinking it is a long informed consent and obviously she is from country,1,1,1,1.000,0,0,TRUE,,,,,,,,,,,,,,,,,,,,
271,29,4:06,I was feeling bored for this question about driving definition,She was thinking driving for work is not fun at all and she don't fully understand the question,0,1,0,0.333,-,-,TRUE,,,,,,,,,,,,,,,,,,,,
272,29,6:42,I was  feeling bored for this bicycles question,"She was thinking having accidents is horrible and she was feeling afraid of that, and recalling her memory of whether she met bicycles and electronic bicycles",0,0,0,0.000,-,-,TRUE,,,,,,,,,,,,,,,,,,,,
273,29,7:31,I was feeling confused about the question,"She was thinking electronic bicycles are very fast and they are dangerous, but don't fully understand why there will be animals on the road, she has not met that situation",0,0,0,0.000,0,0,TRUE,,,,,,,,,,,,,,,,,,,,
274,29,10:41,I was feeling happy that I have confidence to say so,She was thinking influencing traffic flow is better than causing an accidents since safety is the most important thing,0,0,0,0.000,+,0,FALSE,,,,,,,,,,,,,,,,,,,,
275,29,12:17,"I was feeling confused about the device, I am thinking about what the importance ",She was feeling confused about what is the device,2,1,2,1.667,0,0,TRUE,,,,,,,,,,,,,,,,,,,,
276,29,15:43,"I was remembering a terrible parking experience, that is unhappy",She was thinking can the device provide parking help? But it is good to know where there is a empty parking spot.,0,0,0,0.000,-,0,FALSE,,,,,,,,,,,,,,,,,,,,
277,30,2:40,I was thinking I only drive for travelling ,He was thinking how to say it in English and feeling travelling is obviously much funny,0,0,0,0.000,0,0,TRUE,,,,,,,,,,,,,,,,,,,,
278,30,3:50,I was thinking that driving is like a mind trip,He was thinking of his 3-day driving trip before and it was a good experience,0,0,0,0.000,0,+,FALSE,,,,,,,,,,,,,,,,,,,,
279,30,6:15,I was  thinking you could just ask what you want me to provide,He was feeling confused about the question and didn't know what answers the interviewer wants,2,1,2,1.667,0,-,FALSE,,,,,,,,,,,,,,,,,,,,
280,30,6:40,I was just moving after checking everything ,He was trying to understand the description of the scenario and trying to come up with an answer,0,0,0,0.000,0,0,TRUE,,,,,,,,,,,,,,,,,,,,
281,30,7:44,"I was thinking about one movie with a fancy motocycle, though it is dangerous ",He was thinking motobikes are very fast and cause many accidents in country ,1,1,1,1.000,0,0,TRUE,,,,,,,,,,,,,,,,,,,,
282,30,7:56,I was thinking of  a car accident that happened due to a blind corner,He was recalling his memory that related to motorbicycles and they don't follow the rules,0,0,0,0.000,-,-,TRUE,,,,,,,,,,,,,,,,,,,,
283,30,12:10,I was thinking you could just ask me for a suggestion,He  finally understand what the interviewer want to ask and was feeling a bit happy and released,0,0,0,0.000,0,+,FALSE,,,,,,,,,,,,,,,,,,,,
284,30,14:46,I was thinking the image can be displayed on the front windows,He was thinking a image of the street is enough for him to decide what to do,1,0,0,0.333,0,0,TRUE,,,,,,,,,,,,,,,,,,,,
285,30,16:33,I was thinking the interview people is clever ,"He was thinking of how to say it in English and trying to explain. He was feeling that driving in a snowing sunny day, everything is white and it is dangerous",0,0,0,0.000,+,0,FALSE,,,,,,,,,,,,,,,,,,,,
286,30,20:59,I was thinking the interviewer was so clever to find what I would say,"He was thinking language is a problem, if the hint is in native is much better, no need to translate",0,0,0,0.000,0,0,TRUE,,,,,,,,,,,,,,,,,,,,
287,31,4:05,I was thinking how interesting to bring my cat to hike,He was thinking of his experience of going to a place and suprisely the interviewer pays attention to his cat,1,0,0,0.333,+,+,TRUE,,,,,,,,,,,,,,,,,,,,
288,31,4:40,I was recalling how bad experience that taking bus to city,"He was thinking bringing cat in a car is not easy, but he can bring many stuff in the car for travelling is much convenient than taking bus",1,0,0,0.333,-,0,FALSE,,,,,,,,,,,,,,,,,,,,
289,31,9:00,I was thinking usually people drive too fast on highway,"He was thinking what else he should be aware of and he remember he was in a similar situation, he was aware of the other cars, that was dangerous",1,0,0,0.333,-,-,TRUE,,,,,,,,,,,,,,,,,,,,
290,31,9:30,I was thinking the difference of driving behavior between place and place,"He was thinking in that situation, when the other car is a bit faster than him, his driving was influenced by them",0,0,0,0.000,0,-,FALSE,,,,,,,,,,,,,,,,,,,,
291,31,11:50,I was trying to recall whether I have seen intersection without any sign,"He was thinking usually just following the sign to drive,  it is not a problem, it is just a common situation",1,1,0,0.667,0,0,TRUE,,,,,,,,,,,,,,,,,,,,
292,31,12:55,I was thinking an app on my phone opened while Google maps is also running,"He was thinking what is the device and how it looks like, this makes him feel confused",0,0,0,0.000,0,0,TRUE,,,,,,,,,,,,,,,,,,,,
293,31,15:15,I was trying to look for some cases that might be risky,He was thinking image hint is disturbing,0,0,0,0.000,0,-,FALSE,,,,,,,,,,,,,,,,,,,,
294,31,16:45,I was hoping not to meet any animals on the road,He was thinking he has never met wild animals when driving here since he lives in a city. It may be a problem if living in countryside.,1,1,1,1.000,+,0,FALSE,,,,,,,,,,,,,,,,,,,,
295,31,17:30,I was thinking maybe a robot assistant intergrated in the car itself,He was thinking parking is not a problem for him since it is not hard to find in the city. But he is glad that he comes up with another idea.,0,0,0,0.000,+,+,TRUE,,,,,,,,,,,,,,,,,,,,
296,31,18:10,I was thinking idea that automatic driving assist by the device,He was thinking knowing if there is accidents happen is very useful for him but he is not sure if it is helpful for others,0,0,0,0.000,+,0,FALSE,,,,,,,,,,,,,,,,,,,,
297,32,1:10,"I was thinking maybe it's a bit abrupted here, it's better to have a more smooth transition from the introduction to the first question.",He was feeling a bit nervous and curious about the interview,0,0,0,0.000,-,-,TRUE,,,,,,,,,,,,,,,,,,,,
298,32,4:13,"I was thinking that mostly why I am driving is for fun, it does not specificly for any other purpose to be honest.",He was thinking he did not have a favourite one since it is just ordinary driving experience,0,0,1,0.333,+,0,FALSE,,,,,,,,,,,,,,,,,,,,
299,32,5:52,I was confused here because I misundersood the question.,He was feeling a bit confused about the question and don't fully understand it,2,2,2,2.000,-,-,TRUE,,,,,,,,,,,,,,,,,,,,
300,32,6:38,"I was thinking besides, I also need the information of an estimate of how many minutes will I need to wait for the pedestrian, if it need some time, is there any other roads which is faster?",He was feeling a bit nervous of answering this question and don't know why,0,0,0,0.000,+,0,FALSE,,,,,,,,,,,,,,,,,,,,
301,32,7:32,"I was thinking If it's near the cross then the tram which blocking my view will affect my driving, otherwise not really influence. Moreover, the tram and the vehicle do not share the road like it in the city.",He was feeling a bit embarrasing of his English and thinks of  how to answer this question in English,0,0,0,0.000,+,-,FALSE,,,,,,,,,,,,,,,,,,,,
302,32,13:17,I was thinking that I want to know if there any people approaching the intersection here.,He was thinking of that situation and what kind of information he needs,2,0,0,0.667,+,0,FALSE,,,,,,,,,,,,,,,,,,,,
303,32,18:15,"I was thinking the reminder of the possible accident would be better in audio, and the density information in visual.",He was thinking what were the meaning of the two English words and not sure if he explain it clearly,0,0,0,0.000,+,0,FALSE,,,,,,,,,,,,,,,,,,,,
304,32,18:42,"I was providing more choice for the users of the audio style formal, childish, funny, women, men, and so on.",He was thinking he needs time to think what does the audio hint mean and he will be more prefer visualized information,0,0,0,0.000,0,0,TRUE,,,,,,,,,,,,,,,,,,,,
305,32,20:45,I was thinking good idea! I believe the device would be helpful and popular.,He was thinking now he has a clearer understanding of the device and came up with idea of his needs,0,0,0,0.000,+,+,TRUE,,,,,,,,,,,,,,,,,,,,
306,33,2:03,I was happy to think about my past experience (Feel like nostalgia),"She was thinking how many year that she have got her driving license, and she did not frequently drive at the beginning so she felt a bit nervous about the interview",0,0,0,0.000,+,-,FALSE,,,,,,,,,,,,,,,,,,,,
307,33,4:19,I was trying  to think about the answer,"she was thinking they are all the same purposes, do not have a favourite one",1,0,0,0.333,0,0,TRUE,,,,,,,,,,,,,,,,,,,,
308,33,6:29,I was a bit nervous to make sure that I can understand the scenario completely,she was feeling it is hard to summarize definition of driving and hope she will understand the following scenarios,1,1,0,0.667,-,0,FALSE,,,,,,,,,,,,,,,,,,,,
309,33,7:44,I was struggling a bit to explain to make sure that the interviwer understand you.,she was recalling her memory of a similar situation and motorbikes are a problem for her and they easily cause accidents since they are pretty fast,0,0,0,0.000,-,0,FALSE,,,,,,,,,,,,,,,,,,,,
310,33,10:00,I was struggling a bit to explain to make sure that the interviwer understand you.,she was recalling her memory of a similar sitation and she was not able to see through mirrors at all,0,0,0,0.000,-,-,TRUE,,,,,,,,,,,,,,,,,,,,
311,33,11:58,I was try to think about the answer,she was thinking it was exhausting to clean side mirrors during heavy rain and she hopes there will be a better solution,0,0,0,0.000,-,-,TRUE,,,,,,,,,,,,,,,,,,,,
312,33,15:55,I was unsured about my answer,she was thinking this scenario is not difficult and it is easy to answer,1,0,0,0.333,-,+,FALSE,,,,,,,,,,,,,,,,,,,,
