313,33,19:01,I was just trying to explain,she was thinking that she can use the device everyday if she already has it,0,0,0,0.000,0,0,TRUE,,,,,,,,,,,,,,,,,,,,
314,33,25:06,I was happy when I saw the interviewer have the fun mood,she was thinking she will not  trust it until it has been tested for more than 10 years,0,0,0,0.000,+,0,FALSE,,,,,,,,,,,,,,,,,,,,
315,33,25:28,I was listening to the information in neutral emotion and thinking along,she was feeling happy that she comes up with a question and feeling curious about the device,0,0,0,0.000,0,+,FALSE,,,,,,,,,,,,,,,,,,,,
316,34,02:00,I was feeling open to say whatever nonfiltered,He was thinking the interview is gonna be short,0,0,0,0.000,+,+,TRUE,,,,,,,,,,,,,,,,,,,,
317,34,04:00,I was thinking casual questions lightens the mood,He was thinking it was nice to be young and have a car,0,0,0,0.000,+,+,TRUE,,,,,,,,,,,,,,,,,,,,
318,34,13:00,I was having difficulties following the question,He was thinking of bikes that drive too fast,0,0,0,0.000,-,0,FALSE,,,,,,,,,,,,,,,,,,,,
319,34,17:30,I was disappointed not having ideas,He was thinking its difficult question,1,0,0,0.333,-,0,FALSE,,,,,,,,,,,,,,,,,,,,
320,34,18:40,I was happy getting some idea instantly,He was thinking its stupid that you have to look at other peoples signs,0,0,0,0.000,+,-,FALSE,,,,,,,,,,,,,,,,,,,,
321,34,20:00,I was getting and evolving lot of ideas,He was thinking it is hard to speak english,0,0,0,0.000,+,-,FALSE,,,,,,,,,,,,,,,,,,,,
322,34,20:30,I was getting praised for the ideas,He was thinking it is nice that the interviewer liked the idea,2,1,1,1.333,+,+,TRUE,,,,,,,,,,,,,,,,,,,,
323,34,21:40,I was not happy not getting any more ideas,"He was not sure, what the questions is about",0,0,0,0.000,-,0,FALSE,,,,,,,,,,,,,,,,,,,,
324,34,25:30,I was feeling disappointed discussion shifting so much to mining ideas instead of casual chat,He was thinking there is not enough time to think,0,0,0,0.000,-,-,TRUE,,,,,,,,,,,,,,,,,,,,
325,35,2:55,I was thinking that I got a driving license for moped at the age of 15,He was trying to remember when i got license,2,2,1,1.667,0,0,TRUE,,,,,,,,,,,,,,,,,,,,
326,35,4:34,I was thinking my parents cars (nice cars),He was thinking car would be nice,0,1,0,0.333,+,0,FALSE,,,,,,,,,,,,,,,,,,,,
327,35,5:52,"I was amused, i found the question a bit funny",He was thinking its a silly/hard question.,0,2,2,1.333,+,+,TRUE,,,,,,,,,,,,,,,,,,,,
328,35,7:07,I was feeling relaxed,He was thinking its fun to drive and listen to music,1,2,0,1.000,+,+,TRUE,,,,,,,,,,,,,,,,,,,,
329,35,7:34,"I was not relaxed anymore, driving in Hki is not relaxing",He was thinking its stressful to drive in the city,2,2,2,2.000,-,-,TRUE,,,,,,,,,,,,,,,,,,,,
330,35,9:56,I was picturing me driving at intersection next to my house,He was thinking its hard to answer,0,0,0,0.000,0,-,FALSE,,,,,,,,,,,,,,,,,,,,
331,35,11:56,I was trying to think when I was in that situation (heavy rain),He was thinking if you cant see you have to stop driving,0,1,0,0.333,-,0,FALSE,,,,,,,,,,,,,,,,,,,,
332,35,14:07,I was picturing an intersection where a building blocks vision,He was trying to think about more things,0,1,0,0.333,0,0,TRUE,,,,,,,,,,,,,,,,,,,,
333,35,16:35,I was thinking about scumbag spandex bikers who cross roads without looking,He was thinking bikes are dangerous in traffic,1,1,1,1.000,-,-,TRUE,,,,,,,,,,,,,,,,,,,,
334,35,18:48,I was amused when I was forced to tell where I'd use the device,He was thinking he has no answers,0,0,0,0.000,+,0,FALSE,,,,,,,,,,,,,,,,,,,,
335,36,3:19,I was trying to remember when I got my driving license. ,He was trying to remember when i got license,2,2,2,2.000,+,0,FALSE,,,,,,,,,,,,,,,,,,,,
336,36,5:12,I was thinking Interviewer gave me a better explanation for his last argument,He was also thinking that people don't need car because of public transport,0,0,0,0.000,+,0,FALSE,,,,,,,,,,,,,,,,,,,,
337,36,6:45,I was thinking about how do I explain my future plans with couple sentence. ,He was thinking about my work situation,0,0,0,0.000,0,0,TRUE,,,,,,,,,,,,,,,,,,,,
338,36,10:55,I was thinking something clever to say but nothing comes to mind,He was thinking it is very hard to make up the sentence,1,1,2,1.333,0,-,FALSE,,,,,,,,,,,,,,,,,,,,
339,36,13:23,I was  thinking did I anwer to everything or is there some informating missing,He was having hard time explaining,0,0,1,0.333,0,-,FALSE,,,,,,,,,,,,,,,,,,,,
340,36,15:18,I was thinking this thing to be a good solution on paper but maybe it's hard to implement in practice or I wasn't able to think of a feasible solution to this at this moment ,He was thinking that would be very nice thing in future,1,2,1,1.333,0,+,FALSE,,,,,,,,,,,,,,,,,,,,
341,36,17:19,I was listenening closely to the instruction because was thinking still the last part of the interview. Thinking that I need to ask the interviewer to repeat the question.,He was thinking he did not understand the question,2,1,1,1.333,-,-,TRUE,,,,,,,,,,,,,,,,,,,,
342,36,18:53,I was thinking about what is really possible or necessary things to see in a rain,He was thinking about what I would like to see,1,0,2,1.000,0,0,TRUE,,,,,,,,,,,,,,,,,,,,
343,36,19:45,I was thinking if my answer is good or not,He was thinking safety is very important in this case,0,0,0,0.000,-,0,FALSE,,,,,,,,,,,,,,,,,,,,
344,36,24.55,I was thinking that this is quite hard to do in some kind of AI system,He was thinking its technically hard to detect pedestrians,1,2,2,1.667,0,-,FALSE,,,,,,,,,,,,,,,,,,,,
345,37,4:02,I was feeling funny and a bit embarrassed to explain how I was banned to drive in the city,She was thinking it was fun that her family banned her driving,2,2,2,2.000,+,+,TRUE,,,,,,,,,,,,,,,,,,,,
346,37,5:06,I was feeling embarrased to explain how I couldn't drive more again,I was thinking I only drive to transfer myself from place a to place b,0,0,0,0.000,0,+,FALSE,,,,,,,,,,,,,,,,,,,,
347,37,6:47,"I was confirming again the question if I understood correctly, what is the purpose of driving",I was thinking best thing about driving is that you dont need to wait,0,0,0,0.000,+,-,FALSE,,,,,,,,,,,,,,,,,,,,
348,37,9:08,I was trying to make sure and understand why is necessary that people would need extra assistance for traffic,I was thinking I told a fun joke,0,0,0,0.000,+,-,FALSE,,,,,,,,,,,,,,,,,,,,
349,37,10:46,I was thinking what I would need in huge raining  situation,I was thinking I didn't undrstand what kind of notification he means,0,0,0,0.000,0,0,TRUE,,,,,,,,,,,,,,,,,,,,
350,37,12:04,I was reflecting on my own experiences during driving in the city,I was thinking how terrifying it is to drive in city center,1,0,1,0.667,-,0,FALSE,,,,,,,,,,,,,,,,,,,,
351,37,16:35,I was surprised by the differences of car selection standard,I was curious,1,0,1,0.667,+,0,FALSE,,,,,,,,,,,,,,,,,,,,
352,37,21:33,I was thinking what I would need to have better driving experience,I was thinking autopilot does not sound safe,0,0,0,0.000,-,0,FALSE,,,,,,,,,,,,,,,,,,,,
353,37,21:41,I was explaining how auto parking system could help me,I was remembering that I have issues with parking,1,1,0,0.667,0,+,FALSE,,,,,,,,,,,,,,,,,,,,
354,38,2:55,I was hoping I was not giving misinformation about where I am legally allowed to use my  license.,I was thinking about where i can use my license,2,1,2,1.667,0,0,TRUE,,,,,,,,,,,,,,,,,,,,
355,38,8:50,I was feeling relieved that my answer seemed to satisfy the question,I was making sure I understood correctly,0,1,0,0.333,+,0,FALSE,,,,,,,,,,,,,,,,,,,,
356,38,9:30,I was getting excited because I like the concept of being able to think alot while driving as it is something I enjoy,I was thinking about how I like to wonder about different things,1,1,0,0.667,+,+,TRUE,,,,,,,,,,,,,,,,,,,,
357,38,9:45,I was putting myself in the mental space of sitting idly in a room and thinking. This was to help contrast the feeling of thinking while driving in an attempt to help me explain the difference to the interviewer clearly,I was thinking  about how I do not want to waste my time,0,0,0,0.000,0,-,FALSE,,,,,,,,,,,,,,,,,,,,
358,38,11:06,I was mentally disagreeing with the interviewer saying that it is unhealthy to have the opinion I have about thinking because I am addicted to work. ,I was thinking that the interviewer was very fun,0,0,0,0.000,0,+,FALSE,,,,,,,,,,,,,,,,,,,,
359,38,16:15,I was picturing people of various ages at the side of the road while I am driving at a cross walk and traffic light. There are small children running around and I was thinking about the feeling of caution I get when I am in this situation in real life. This contrasts the more relaxed feeling if the nearby pedestrians were all elderly because they tend to move more slowly and are therefore easier to avoid with my car.,I was thinking that I am careful about people near the road incase they jump ,2,1,0,1.000,0,-,FALSE,,,,,,,,,,,,,,,,,,,,
360,38,21:49,I was remembering this time a guy in a giant truck passed me (he was going 80 mph in a 45 zone) and it scared and stressed me.,I was not sure if the word is correct,0,0,0,0.000,-,0,FALSE,,,,,,,,,,,,,,,,,,,,
361,38,21:55,I was internally laughing because I thought Interviewer may believe I drive like an old lady due to my description of how I handled the heavy rain situation (turned on the hazard lights and drove slowly in the shoulder),I was searching for word,0,0,0,0.000,+,0,FALSE,,,,,,,,,,,,,,,,,,,,
362,38,30:12,I was thinking about the quote from Henry Ford about horses running faster,I was thinking that the device sounds nice,0,0,0,0.000,0,+,FALSE,,,,,,,,,,,,,,,,,,,,
363,38,36:34,I was curious about the nature of the device or research outcomes from the surveys," I was thinking this is nice idea, is it actually being made?",1,0,0,0.333,+,+,TRUE,,,,,,,,,,,,,,,,,,,,
364,39,02:55,"I was thinkling Oh man, my english is so bad…",I was thinking about when I got my license,0,0,0,0.000,0,0,TRUE,,,,,,,,,,,,,,,,,,,,
365,39,05:30,I was thinking this is a weird one. Well i'll throw something wise.,I was thinking about where I like to drive,0,0,0,0.000,+,0,FALSE,,,,,,,,,,,,,,,,,,,,
366,39,05:37,"I was thinking this is not true but I didn't find the words. Car is a ""have to be"" vehicle. I'll drive just for fun if I find the time but normally it is just frustrating to work and back driving.",I was thinking that I said a funny thing,0,0,0,0.000,-,+,FALSE,,,,,,,,,,,,,,,,,,,,
367,39,05:57,"I was thinking, I have no idea what song you are talking about  I'll just laugh.",I was thinking about a song,0,1,1,0.667,0,0,TRUE,,,,,,,,,,,,,,,,,,,,
368,39,07:12,I was thinking what an accidental rhyme! Did you notice?,I was not happy with my answer,0,0,0,0.000,+,-,FALSE,,,,,,,,,,,,,,,,,,,,
369,39,08:16,I was thinking I have really no idea what the topic of this question is.,I was not understanding the question,2,2,2,2.000,-,-,TRUE,,,,,,,,,,,,,,,,,,,,
370,39,14:50,I was getting bored not to know anything.,I was thinking that I said a stupid thing,0,0,0,0.000,-,+,FALSE,,,,,,,,,,,,,,,,,,,,
371,39,18:00,I was not sure if you mean that.,I was not sure about a word I used,1,1,0,0.667,0,0,TRUE,,,,,,,,,,,,,,,,,,,,
372,39,19:00,I was having a certain picture of the smartphone-like device in my mind but I have no idea what it could used for or how practical it would be.,I was not understanding the question,0,0,0,0.000,0,-,FALSE,,,,,,,,,,,,,,,,,,,,
373,39,20:00,I was wishing  this would stop already. I think I have nothing left to give to this conversation.,I was having hard time with English,0,0,0,0.000,-,-,TRUE,,,,,,,,,,,,,,,,,,,,
374,40,02:05,"I was regretting about why I didn't change my driving license in country, would be really easy then",I was thinking how I missed my shot on expanding my license,2,1,0,1.000,-,-,TRUE,,,,,,,,,,,,,,,,,,,,
375,40,02:45,I was thinking when exactly I appeared for the test,I was remembering when I got license,1,0,0,0.333,0,0,TRUE,,,,,,,,,,,,,,,,,,,,
376,40,05:38,"I was thinking, actually, the car was a gift for my Father; he sold his older car after getting this. I go to the country for less time so I just use the same car.",I was thinking about my car situation,1,0,0,0.333,+,0,FALSE,,,,,,,,,,,,,,,,,,,,
377,40,06:31,I was thinking whether you are familiar with what a compact SUV is and why is it relevant for the country's market ,"I was thinking about my car, which is a good car",1,0,0,0.333,+,+,TRUE,,,,,,,,,,,,,,,,,,,,
378,40,09:20,I was  a bit lazy person I think that’s why I prefer someone else to drive and I just enjoy the journey ,I was thinking I have lost interest in driving,1,0,0,0.333,+,-,FALSE,,,,,,,,,,,,,,,,,,,,
379,40,11:49,"I was thinking how lucky you are that you don't have to drive in 40 C hot weather stuck in traffic, you are saved my friend.",I was thinking that in country there is a lot more traffic,1,0,0,0.333,+,0,FALSE,,,,,,,,,,,,,,,,,,,,
380,40,13:42,I was actually thinking about me standing at one of those intersections in front of city center and what other drivers did when the lights turned green.,I was thinking about the situation,1,0,2,1.000,+,0,FALSE,,,,,,,,,,,,,,,,,,,,
381,40,14:55,I was thinking about one situation when we were driving in heavy rain in the country and we saw a tree failing on the same road after we had crossed the exact same place just 2-3 sec before. It was a bit scary,I was thinking about improving driving using information from computer vision,0,0,0,0.000,-,+,FALSE,,,,,,,,,,,,,,,,,,,,
382,40,18:30,I was thinking about my car features followed by thinking about a Tesla's autonomous driving features,I was thinking about type of notifications,0,0,0,0.000,+,0,FALSE,,,,,,,,,,,,,,,,,,,,
383,40,32:10,I was thinking about the helping drivers to drive safely and comfortably with some machines or tools,I was disagreeing,0,0,0,0.000,+,-,FALSE,,,,,,,,,,,,,,,,,,,,
384,41,2:00,"I was thinking ""no deception, great.  At least this is not some experiment secretly testing me then""",I was thinking that I cant leave because we are friends,0,0,0,0.000,0,0,TRUE,,,,,,,,,,,,,,,,,,,,
385,41,5:06,I was realizing I had been lying,I was thinking that I actually did not live in the place,1,1,0,0.667,0,0,TRUE,,,,,,,,,,,,,,,,,,,,
386,41,5:42,I was thinking that was great banter,I was thinking that was a funny joke,2,0,0,0.667,+,+,TRUE,,,,,,,,,,,,,,,,,,,,
387,41,7:25,I was amused again. What a question ,I was thinking that was a weird question,1,2,2,1.667,+,0,FALSE,,,,,,,,,,,,,,,,,,,,
388,41,9:15,I was thinking you look like you made the best joke ever. Which also was obviously,I was thinking that was a nice analogy,0,0,0,0.000,+,+,TRUE,,,,,,,,,,,,,,,,,,,,
389,41,11:40,I was thinking if that really was the whole question,I was thinking that was a weird question,1,1,2,1.333,0,0,TRUE,,,,,,,,,,,,,,,,,,,,
390,41,13:17,I was trying to really immerse myself into the mentioned situation,I was not able to think of anything,0,0,0,0.000,0,-,FALSE,,,,,,,,,,,,,,,,,,,,
391,41,14:30,I was really starting to question the questions. Maybe even doubting if I understand what kind of answers you want,I was thinking a question is a bit silly,1,1,0,0.667,-,+,FALSE,,,,,,,,,,,,,,,,,,,,
392,41,15:30,"I was thinking ""am I the inventor here?""",I was thinking that designers should answer this,1,0,2,1.000,0,0,TRUE,,,,,,,,,,,,,,,,,,,,
393,41,20:13,I was feeling relieved I might for once have something useful-ish to say,I was thinking about special group of vehicles,0,0,0,0.000,+,0,FALSE,,,,,,,,,,,,,,,,,,,,
394,42,5.23,I was thinking about how I don't really enjoy driving so much,I was thinking that I dont use car because I dont like to drive in city,1,1,1,1.000,-,-,TRUE,,,,,,,,,,,,,,,,,,,,
395,42,5.33,I was thinking whether I was now able to pronounce rarely ,I was thinking I haven't driven often lately,0,0,0,0.000,0,-,FALSE,,,,,,,,,,,,,,,,,,,,
396,42,6.44,I was thinking about myself being a bit nervous driving,I was thinking about how I get nervous when  I drive,2,2,2,2.000,-,-,TRUE,,,,,,,,,,,,,,,,,,,,
397,42,9.00,"I was feeling like I might answer something stupid, a bit like as if this was a question in exam ",I was thinking about what kind of info I would like to have,0,0,0,0.000,-,0,FALSE,,,,,,,,,,,,,,,,,,,,
398,42,9.57,I was feeling a bit difficult to imagine what to do in that situation as I can't improve my vision,I was trying to think about what I would  do,1,0,0,0.333,-,0,FALSE,,,,,,,,,,,,,,,,,,,,
399,42,10.42,I was unsure whether I was understood,I was trying to think about more scenarios,0,0,0,0.000,-,0,FALSE,,,,,,,,,,,,,,,,,,,,
400,42,10.52,I was thinking that we did't understand each other but it was hard to explain so we didn't continue with that question,I was wondering what is happening,0,0,1,0.333,-,-,TRUE,,,,,,,,,,,,,,,,,,,,
401,42,12.49,"I was confused, thinking I already answered this",I was thinking that I would like to see what is coming,0,0,0,0.000,-,0,FALSE,,,,,,,,,,,,,,,,,,,,
402,42,13.49,"I was creative, thinking about possible uses for device",I was thinking that I would like to have an alarm for high speed cars,0,0,0,0.000,+,0,FALSE,,,,,,,,,,,,,,,,,,,,
403,42,16.05,"I was trying to imagine situations, but nothing came to mind",I was trying to think of something more.,1,1,1,1.000,0,0,TRUE,,,,,,,,,,,,,,,,,,,,
404,43,1:14, I was feeling neutral ,I was thinking how to describe where I was born,0,0,0,0.000,0,0,TRUE,,,,,,,,,,,,,,,,,,,,
405,43,3:48,  I was  happy ,I was finding interviewers reaction funny,0,0,0,0.000,+,+,TRUE,,,,,,,,,,,,,,,,,,,,
406,43,4:45,  I was  contemplative ,I was trying to remember when I got my license,1,0,1,0.667,0,0,TRUE,,,,,,,,,,,,,,,,,,,,
407,43,5:20, I was  joyful ,I was thinking how I got my license asap,0,0,0,0.000,+,+,TRUE,,,,,,,,,,,,,,,,,,,,
408,43,8:00,  I was  pensive ,I was thinking about my answer,1,1,0,0.667,0,0,TRUE,,,,,,,,,,,,,,,,,,,,
409,43,11:15, I was thinking that I should practice more english ,I was thinking about the word ,0,0,0,0.000,0,0,TRUE,,,,,,,,,,,,,,,,,,,,
410,43,12:10, I was blackout ,I was trying to remember a word,1,1,0,0.667,-,0,FALSE,,,,,,,,,,,,,,,,,,,,
411,43,14:10, I was focused ,I was suprised that there was only one more,0,0,0,0.000,0,+,FALSE,,,,,,,,,,,,,,,,,,,,
412,43,17:00, I was thinking that I'm stumbling with my words ,I was trying to think when I would use the device,0,0,0,0.000,0,0,TRUE,,,,,,,,,,,,,,,,,,,,
413,43,19:40,I was  thinking this went fast ,I was thinking if I have any questions,0,0,0,0.000,+,0,FALSE,,,,,,,,,,,,,,,,,,,,
414,44,3:40,I was thinking of driving experiences I will describe in my next answer,I was thinking why I like driving,1,0,0,0.333,+,+,TRUE,,,,,,,,,,,,,,,,,,,,
415,44,5:21,I was imagining the scenario described and thinking about my aswer,I was thinking that I drive,0,0,0,0.000,0,0,TRUE,,,,,,,,,,,,,,,,,,,,
416,44,5:43,I was thinking that maybe I am not giving too good input to the person using it,I was thinking the situation was silly,0,0,0,0.000,+,+,TRUE,,,,,,,,,,,,,,,,,,,,
417,44,7:10,I was trying to think words in english,I was struggling with english,2,2,2,2.000,0,-,FALSE,,,,,,,,,,,,,,,,,,,,
418,44,9:59,I was thinking about the intersection close to my home,I was imaging the situation,1,0,1,0.667,0,0,TRUE,,,,,,,,,,,,,,,,,,,,
419,44,10:39,I was again wondering what are these questions,I was thinking that was a stupid question,2,1,0,1.000,0,0,TRUE,,,,,,,,,,,,,,,,,,,,
420,44,10:57, I was trying to remember how driving rules work,I was trying to think more things,0,0,1,0.333,0,0,TRUE,,,,,,,,,,,,,,,,,,,,
421,44,12:22, I was frustrated because my earbuds were falling off,I was having trouble hearing,0,1,0,0.333,-,0,FALSE,,,,,,,,,,,,,,,,,,,,
422,44,14:05, I was thinking about driving in big parking lots and stressing about it,I was thinking about parking,1,1,1,1.000,-,0,FALSE,,,,,,,,,,,,,,,,,,,,
423,44,17:07, I was laughing to what I'm about to say,I was thinking why is he asking if I have questions if he does not know answers,0,0,0,0.000,+,+,TRUE,,,,,,,,,,,,,,,,,,,,
424,45,1:23,I was amused by some local humor regarding my childhood home town,I was thinking about my hometown,1,0,1,0.667,+,+,TRUE,,,,,,,,,,,,,,,,,,,,
425,45,5:25,I was Fascinated,I was trying to understand the question,0,0,0,0.000,+,0,FALSE,,,,,,,,,,,,,,,,,,,,
426,45,9:50,I was confused,I was trying to think something,0,0,0,0.000,0,0,TRUE,,,,,,,,,,,,,,,,,,,,
427,45,11:17,I was confused,I was trying to understand the question,1,1,2,1.333,0,0,TRUE,,,,,,,,,,,,,,,,,,,,
428,45,13:40,I was frustrated,I was trying to understand the question,0,0,1,0.333,-,0,FALSE,,,,,,,,,,,,,,,,,,,,
429,45,15:08,I was confused,I was thinking the question is stupid,0,0,0,0.000,-,-,TRUE,,,,,,,,,,,,,,,,,,,,
430,45,18:19,I was frustrated by the same question I found confusing earlier,I was thinking it is a silly question,0,1,0,0.333,-,0,FALSE,,,,,,,,,,,,,,,,,,,,
431,45,21:27,I was frustrated by the same question I found confusing earlier,I was trying to think about answers,0,0,0,0.000,-,0,FALSE,,,,,,,,,,,,,,,,,,,,
432,45,23:50,I was delighted by interesting question for change,I was trying to listen carefully,1,0,0,0.333,+,0,FALSE,,,,,,,,,,,,,,,,,,,,
433,45,27:20,I was relieved that interviewer understood my point of view,I was trying to think of an answer,0,0,0,0.000,+,0,FALSE,,,,,,,,,,,,,,,,,,,,
434,46,2:44,I was thinking about how old my car is,I was trying to think how old the car is,2,2,2,2.000,0,0,TRUE,,,,,,,,,,,,,,,,,,,,
435,46,2:52,I was thinking how many kilometers my car has,I was thinking how much the car has been driven,2,2,2,2.000,+,0,FALSE,,,,,,,,,,,,,,,,,,,,
436,46,4:32,I was thinking about what a weird question that is and how to answer it correctly,I was trying to think for purpose,0,0,0,0.000,+,0,FALSE,,,,,,,,,,,,,,,,,,,,
437,46,5:10,I was thinking if I could come up with any reasonable answer,I was not knowing what to say,1,1,0,0.667,+,0,FALSE,,,,,,,,,,,,,,,,,,,,
438,46,5:40,I was thinking how to summarize what driving really means for me,I was happy with my sentence,0,0,0,0.000,0,+,FALSE,,,,,,,,,,,,,,,,,,,,
439,46,7:05,I was thinking about what kind of information I need in the described situation,I was trying to think what kind of information I need,2,2,2,2.000,0,0,TRUE,,,,,,,,,,,,,,,,,,,,
440,46,7:33,I was thinking about how I should answer the question,I was trying to think what kind of information I need,0,1,0,0.333,0,0,TRUE,,,,,,,,,,,,,,,,,,,,
441,46,7:49,I was thinking about what kind of information I could help me to make me a better driver in that situation,I was thinking what could be ideal to see,2,0,2,1.333,0,0,TRUE,,,,,,,,,,,,,,,,,,,,
442,46,9:13,I was thinking if I would stop completely in that kind of situation or just drive slower,I was thinking should I stop or not,2,2,2,2.000,0,0,TRUE,,,,,,,,,,,,,,,,,,,,
443,46,11:37,I was thinking that it would be good if there's a device that helps you see those dead angles behind the buildings,I was thinking I would like to see through buildings,2,1,2,1.667,+,0,FALSE,,,,,,,,,,,,,,,,,,,,
,,,,,,,,,,,,,,,,,,,,,,,,,,,,,,,
,,,,,,,,,,,,,,,,,,,,,,,,,,,,,,,
,,,,,,,,,,,,,,,,,,,,,,,,,,,,,,,
,,,,,,,,,,,,,,,,,,,,,,,,,,,,,,,
,,,,,,,,,,,,,,,,,,,,,,,,,,,,,,,
,,,,,,,,,,,,,,,,,,,,,,,,,,,,,,,
,,,,,,,,,,,,,,,,,,,,,,,,,,,,,,,
,,,,,,,,,,,,,,,,,,,,,,,,,,,,,,,
,,,,,,,,,,,,,,,,,,,,,,,,,,,,,,,
,,,,,,,,,,,,,,,,,,,,,,,,,,,,,,,
,,,,,,,,,,,,,,,,,,,,,,,,,,,,,,,
,,,,,,,,,,,,,,,,,,,,,,,,,,,,,,,
,,,,,,,,,,,,,,,,,,,,,,,,,,,,,,,
,,,,,,,,,,,,,,,,,,,,,,,,,,,,,,,
,,,,,,,,,,,,,,,,,,,,,,,,,,,,,,,
,,,,,,,,,,,,,,,,,,,,,,,,,,,,,,,
,,,,,,,,,,,,,,,,,,,,,,,,,,,,,,,
,,,,,,,,,,,,,,,,,,,,,,,,,,,,,,,
,,,,,,,,,,,,,,,,,,,,,,,,,,,,,,,
,,,,,,,,,,,,,,,,,,,,,,,,,,,,,,,
,,,,,,,,,,,,,,,,,,,,,,,,,,,,,,,
,,,,,,,,,,,,,,,,,,,,,,,,,,,,,,,
,,,,,,,,,,,,,,,,,,,,,,,,,,,,,,,
,,,,,,,,,,,,,,,,,,,,,,,,,,,,,,,
,,,,,,,,,,,,,,,,,,,,,,,,,,,,,,,
,,,,,,,,,,,,,,,,,,,,,,,,,,,,,,,
,,,,,,,,,,,,,,,,,,,,,,,,,,,,,,,
,,,,,,,,,,,,,,,,,,,,,,,,,,,,,,,
,,,,,,,,,,,,,,,,,,,,,,,,,,,,,,,
,,,,,,,,,,,,,,,,,,,,,,,,,,,,,,,
,,,,,,,,,,,,,,,,,,,,,,,,,,,,,,,
,,,,,,,,,,,,,,,,,,,,,,,,,,,,,,,
,,,,,,,,,,,,,,,,,,,,,,,,,,,,,,,
,,,,,,,,,,,,,,,,,,,,,,,,,,,,,,,
,,,,,,,,,,,,,,,,,,,,,,,,,,,,,,,
,,,,,,,,,,,,,,,,,,,,,,,,,,,,,,,
,,,,,,,,,,,,,,,,,,,,,,,,,,,,,,,
,,,,,,,,,,,,,,,,,,,,,,,,,,,,,,,
,,,,,,,,,,,,,,,,,,,,,,,,,,,,,,,
,,,,,,,,,,,,,,,,,,,,,,,,,,,,,,,
,,,,,,,,,,,,,,,,,,,,,,,,,,,,,,,
,,,,,,,,,,,,,,,,,,,,,,,,,,,,,,,
,,,,,,,,,,,,,,,,,,,,,,,,,,,,,,,
,,,,,,,,,,,,,,,,,,,,,,,,,,,,,,,
,,,,,,,,,,,,,,,,,,,,,,,,,,,,,,,
,,,,,,,,,,,,,,,,,,,,,,,,,,,,,,,
,,,,,,,,,,,,,,,,,,,,,,,,,,,,,,,
,,,,,,,,,,,,,,,,,,,,,,,,,,,,,,,
,,,,,,,,,,,,,,,,,,,,,,,,,,,,,,,
,,,,,,,,,,,,,,,,,,,,,,,,,,,,,,,
,,,,,,,,,,,,,,,,,,,,,,,,,,,,,,,
,,,,,,,,,,,,,,,,,,,,,,,,,,,,,,,
,,,,,,,,,,,,,,,,,,,,,,,,,,,,,,,
,,,,,,,,,,,,,,,,,,,,,,,,,,,,,,,
,,,,,,,,,,,,,,,,,,,,,,,,,,,,,,,
,,,,,,,,,,,,,,,,,,,,,,,,,,,,,,,
,,,,,,,,,,,,,,,,,,,,,,,,,,,,,,,
,,,,,,,,,,,,,,,,,,,,,,,,,,,,,,,
,,,,,,,,,,,,,,,,,,,,,,,,,,,,,,,
,,,,,,,,,,,,,,,,,,,,,,,,,,,,,,,
,,,,,,,,,,,,,,,,,,,,,,,,,,,,,,,
,,,,,,,,,,,,,,,,,,,,,,,,,,,,,,,
,,,,,,,,,,,,,,,,,,,,,,,,,,,,,,,
,,,,,,,,,,,,,,,,,,,,,,,,,,,,,,,
,,,,,,,,,,,,,,,,,,,,,,,,,,,,,,,
,,,,,,,,,,,,,,,,,,,,,,,,,,,,,,,
,,,,,,,,,,,,,,,,,,,,,,,,,,,,,,,
,,,,,,,,,,,,,,,,,,,,,,,,,,,,,,,
,,,,,,,,,,,,,,,,,,,,,,,,,,,,,,,
,,,,,,,,,,,,,,,,,,,,,,,,,,,,,,,
,,,,,,,,,,,,,,,,,,,,,,,,,,,,,,,
,,,,,,,,,,,,,,,,,,,,,,,,,,,,,,,
,,,,,,,,,,,,,,,,,,,,,,,,,,,,,,,
,,,,,,,,,,,,,,,,,,,,,,,,,,,,,,,
,,,,,,,,,,,,,,,,,,,,,,,,,,,,,,,
,,,,,,,,,,,,,,,,,,,,,,,,,,,,,,,
,,,,,,,,,,,,,,,,,,,,,,,,,,,,,,,
,,,,,,,,,,,,,,,,,,,,,,,,,,,,,,,
,,,,,,,,,,,,,,,,,,,,,,,,,,,,,,,
,,,,,,,,,,,,,,,,,,,,,,,,,,,,,,,
,,,,,,,,,,,,,,,,,,,,,,,,,,,,,,,
,,,,,,,,,,,,,,,,,,,,,,,,,,,,,,,
,,,,,,,,,,,,,,,,,,,,,,,,,,,,,,,
,,,,,,,,,,,,,,,,,,,,,,,,,,,,,,,
,,,,,,,,,,,,,,,,,,,,,,,,,,,,,,,
,,,,,,,,,,,,,,,,,,,,,,,,,,,,,,,
,,,,,,,,,,,,,,,,,,,,,,,,,,,,,,,
,,,,,,,,,,,,,,,,,,,,,,,,,,,,,,,
,,,,,,,,,,,,,,,,,,,,,,,,,,,,,,,
,,,,,,,,,,,,,,,,,,,,,,,,,,,,,,,
,,,,,,,,,,,,,,,,,,,,,,,,,,,,,,,
